,장소명,요약,장소사진,평점,리뷰수,주소
152,스페이스 씨,"압구정 CGV에서 세광길을 따라 5분쯤 걸으면 스페이스C에 이른다. 지하철에서 곧장 이어지는 길이 아니니 최소한의 발품은 팔아야 한다. 하지만 그 수고가 아깝지 않은 공간이다. 
",https://korean.visitseoul.net//data/POST/20160108//0108142932162-ca6534bd66684aa281b44274bc46ec66.png,평점:5.0,,"  서울특별시 강남구 언주로 827, 스페이스씨 (신사동)"
153,의학박물관 (구 대한의원) ,의학박물관(구 대한의원)은 서울대학교 의과대학에 있는 조선 말기의 건물이다. ,https://korean.visitseoul.net//data/POST/20171024//201710241610006481,평점:4,11 ,서울특별시 종로구 대학로 101 (연건동)
154,인천국제공항 제 1터미널 서울관광정보센터 (동편),인천국제공항 동편에 위치한 인천국제공항 서울관광정보센터는 한국을 방문하는 해외 여행객들을 위해 연중무휴 열려있다.,https://korean.visitseoul.net//data/POST/20160119//0119100720696-7481c8b63ac2469fb0e4c4fdf273b1de.jpg,,,"인천 중구 공항로 272 (운서동, 인천국제공항여객터미널)  1층 입국장 5번출구"
155,영학정,옛 군사들의 훈련장이었던 영학정은 양궁장·국궁장·정자로 이루어져 있다.,https://korean.visitseoul.net//data/POST/20170831//201708311014476071,,,서울 양천구 목동동로 316-8 (영학정)
156,북촌동양문화박물관,북촌한옥마을이 자리한 북촌동양문화박물관에서는 설립자 권영두 과장이 30년 동안 수집 및 소장한 한국과 아시아 문화 예술품을 전시하고 있다. ,https://korean.visitseoul.net//data/POST/20160113//0113164121524-1a52c4a577f34c659a0c3f0f617dcd41.jpg,평점:4,4 ,서울 종로구 북촌로11길 76
157,김포공항관광정보센터,김포공항 국제선 입국장 내 자리한 김포공항관광정보센터는 국제선 청사 1층에 위치해 있다.,https://korean.visitseoul.net//data/POST/20160119//0119095436821-049629d5f8e442799f4df30df227c204.jpg,,,"서울 강서구 하늘길 38 (방화동, 김포공항(국제청사))"
158,생각꿈틀미술관,생각꿈틀미술관은 서울 서초구 서초동에 위치한 미술관이다. ,https://korean.visitseoul.net//data/POST/20160110//0110120229926-4b3f3ac702e44319bdda9b3e78075b4d.png,평점:4.5,,"서울특별시 서초구 동산로 55, 언남고등학교 내 언남문화체육센터 (양재동)"
159,금호미술관,경복궁 근처에 위치한 금호미술관에서는 기성작가의 기획전을 비롯해 뛰어난 신인 작가의 기획전을 동시에 감상할 수 있다.,https://korean.visitseoul.net//data/POST/20170817//201708171603117621,평점:4.5,,"서울 종로구 삼청로 18 (사간동, 금호미술관)"
160,춘원당 한의약박물관,"2008년 개관한 춘원당 한방박물관은 탕전실, 품질검사실 및 문화공간, 진료실, 치료실 등으로 총 지하 1층, 지상 6층으로 이뤄져 있다.",https://korean.visitseoul.net//data/POST/20170825//201708251735437261,평점:4,3 ,서울 종로구 돈화문로9길 27 (춘원당한방박물관)
161,풍납토성,풍납토성은 서울 송파구 풍납동에 있는 백제시대 토성 터이다.,https://korean.visitseoul.net//data/POST/20160930//0930152519655-3b28d46ed9674828bbe7bf770a183725.jpg,,,서울특별시 송파구 한가람로20길 30 (풍납동)
162,의릉,성북구 석관동 한국예술종합학교 내부에 자리해 있는 조선 20대 왕 경종과 선의왕후의 무덤인 의릉은 일반적으로 나란히 놓이는 쌍릉과 달리 왕과 왕비의 능이 앞뒤로 배치돼 있다.,https://korean.visitseoul.net//data/POST/20160113//0113132918823-43ceb226b02447988916083b81b3a843.jpg,평점:4,2 ,서울 성북구 화랑로32길 146-37 (의릉)
163,공평도시유적전시관,땅 속에 묻혀 있던 조선 초기~일제 강점기 600년 역사를 한눈에 볼 수 있는 <공평도시유적전시관>이 서울 종로 공평동에 개관했다. ,https://korean.visitseoul.net//data/POST/20180920//201809201107397171,평점:5.0,,서울 종로구 우정국로 26 (센트로폴리스 지하 1층)
164,효자베이커리,콘브레드가 유명한 서촌 1호 빵집,https://korean.visitseoul.net//data/MEDIA/20230629/0629162200116-0e6362cbfeb542e49f5d8c7569b59f20.jpg,,,서울 종로구 필운대로 54
165,서울중앙우체국,"서울의 중심부인 명동에 위치한 서울중앙우체국은 스카이홀의 해외 비즈니스 고객에 알맞은 동시통역뿐만 아니라, 다목적용으로 쓸 수 있는 편안하고 효율적인 회의장과 리셉션홀도 제공하고 있다.",https://korean.visitseoul.net//data/POST/20180213//201802131305384051,평점:4.5,,"서울 중구 소공로 70 (충무로1가, 서울중앙우체국청사)"
166,위안부 '기억의 터',‘기억의 터’는 위안부 피해자 할머니들을 기리는 추모공원이다.,https://korean.visitseoul.net//data/POST/20161108//201611081717288011,평점:4.0,,서울 중구 퇴계로26가길 6 (예장동)  서울종합방재센터
167,고궁을 찾다,조선시대의 궁궐이 다섯 개 남아 방문객들에게 과거 궁중에서의 삶에 대해 짐작하게 해준다. ,https://korean.visitseoul.net//data/POST/20160125//0125183130402-a842253ea35a4e2b9f4260614bc57f0d.jpg,평점:4.5,,
168,초전섬유퀼트박물관,초전섬유퀼트박물관은 1998년에 설립된 섬유 및 퀼트 작품을 전시하는 박물관이다.,https://korean.visitseoul.net//data/POST/20160114//0114143149549-0c63289cedcb42fb95adef5782381d41.jpg,평점:2,1 ,서울 중구 퇴계로18길 66 (제일빌딩)
169,경찰박물관,국민과 경찰이 함께하는 역사와 체험의 복합문화공간	,https://korean.visitseoul.net//data/POST/20170201//201702011541053861,평점:4.0,,"서울 종로구 새문안로 41 (신문로2가, 경찰박물관)"
170,금박연,조선왕실 비단에 금박을 새기던 가업이 계승된 곳,https://korean.visitseoul.net//data/MEDIA/20230629/0629120017324-44b1f541c9de45ba90e493d8afe85842.jpg,,,서울 종로구 북촌로12길 24-12
171,경희대학교 중앙박물관,경희대학교 중앙박물관은 경희대학교 부속 박물관으로 1955년 설립되었다. ,https://korean.visitseoul.net//data/POST/20160114//0114165326156-52630753f1894cc886105c89c5ea154b.jpg,평점:4.5,126 ,서울특별시 동대문구 경희대로 26 경희대학교 서울캠퍼스   중앙도서관 4층
172,혜화문,1397년(태조 5) 도성을 에워싸는 성곽을 쌓을 때 도성의 북동방에 설치한 문(門)이다.,https://korean.visitseoul.net//data/POST/20190701//201907011131197851,평점:5.0,,"서울 종로구 창경궁로 307 (혜화동, 혜화문)"
173,송월동 일대,"종로구 송월동 일대에는 덕수궁, 서울역사박물관, 경희궁, 숭례문, 서대문형무소역사관, 독립문 등 대한민국의 다양한 역사적 유적지들이 위치해 있다.",https://korean.visitseoul.net//data/POST/20160118//0118131017733-70cd6698d1064342bb4a296c0da1a48b.jpg,평점:4.5,,  서울특별시 종로구 송월동 일대
174,목인박물관,목인박물관은 서울 종로구 인사동에 위치한 목 조각 전문박물관이다. ,https://korean.visitseoul.net//data/POST/20171024//201710240936235051,평점:4.5,,서울특별시 종로구 인사동11길 20  (견지동)
175,아원공방,"갤러리 구경과 쇼핑을 함께 즐길 수 있는 금속공예샵
",https://korean.visitseoul.net//data/MEDIA/20230630/0630115502764-12030ebc3bbc4a0d96aee1b6ed1bfb8a.jpg,평점:4.0,,서울 종로구 북촌로5가길 3
176,예술가의 집 (구 서울대학교 본관),대학로의 한국문화예술위원회 건물은 로마네스크 풍의 붉은 석조 건물로 시선을 끈다. 1928년 지어졌으니 80년이 된 건물이다.,https://korean.visitseoul.net//data/POST/20160112//0112094916239-d5addba9efa644d999c57cdc4891c3cb.png,평점:3.5,,  서울특별시 종로구 동숭길 3 (동숭동)
177,국립중앙도서관,국립중앙도서관은 한국의 지적문화유산을 체계적으로 수집해 보관하고 있는 우리나라 대표 도서관이다. ,https://korean.visitseoul.net//data/POST/20170901//201709011152173761,평점:4.5,11 ,초구 반포대로 201 (반포동)
178,방이동 백제고분군,방이동 백제고분군은 사적 제270호로 지정된 방이동 일대에 있는 백제전기의 무덤들이다. ,https://korean.visitseoul.net//data/POST/20170831//201708311350453391,평점:4.0,,서울특별시 송파구 오금로 219 (방이동)
179,이음피움 봉제역사관,"이음피움 봉제역사관은 동대문 패션타운의 배후생산기지인 창신동에 자리 잡고 있으며, 우리의 삶과 함께 해온 봉제 산업을 다양한 관점에서 조망하는 도심 속 문화역사공간입니다. ",https://korean.visitseoul.net//data/POST/20181120//201811201517122641,평점:4.5,,"서울 종로구 창신4가길 26 (창신동, 이음피움 봉제역사관)"
180,서울하수도과학관,국내외 하수도의 역사⸳기술⸳미래상을 전시하고 있는 과학관과 하수처리시설을 직접 견학할 수 있는 물재생센터를 함께 운영하는 현장 중심형 공간입니다.,https://korean.visitseoul.net//data/POST/20200720//202007201445553621,평점:4.5,,서울 성동구 자동차시장3길 64 (용답동)  서울하수도과학관
181,성균관대학교,성균관대학교는 서울 종로구에 위치한 인문사회과학캠퍼스와 경기도 수원시에 위치한 자연과학캠퍼스로 나뉘어 운영되고 있다.,https://korean.visitseoul.net//data/POST/20161122//201611221426210581,평점:4.0,,"서울 종로구 성균관로 25-2 (명륜3가, 성균관대학교)"
182,살곶이다리（전곶교）,조선시대의 석조 다리인 살곶이다리는 1967년 사적 제160호로 지정되었다가 2011년 보물 제1738호로 승격되었다. ,https://korean.visitseoul.net//data/POST/20160926//0926162312791-3912510db66b44a08227a4eac0e6cd60.jpg,,,  서울 성동구 행당동  58
183,호미화방,한국 미술 발전의 함께한 홍대 앞 화방,https://korean.visitseoul.net//data/MEDIA/20230629/0629153445575-4ef4a60b6a22446eb4b690f1e471ffe0.jpg,평점:4.5,,서울 마포구 홍익로3길 20 1층
184,아라아트센터,인사동에 위치하는 아라아트센터는 기획 전시 공간에 대한 바람에서 고안된 곳이다.,https://korean.visitseoul.net//data/POST/20180213//201802131501151591,평점:4.5,,서울 종로구 인사동9길 26 (견지동)
185,북촌마을관광안내소,"북촌마을안내소는 정독도서관 내 부지를 활용하여 2014년 8월 건립되었으며 영어, 일본어, 중국어가 가능한 관광안내사를 통해 관광객을 위한 관광정보 제공 및 통역 안내서비스를 제공한다. ",https://korean.visitseoul.net//data/POST/20181024//201810241734499861,,,"서울 종로구 북촌로5길 48 (화동, 정독도서관)  정독도서관 부지내, 서울교육박물관 앞"
186,인천공항 제2여객터미널 관광정보센터 ,인천공항 제2여객터미널에 위치한 관광정보센터로 2018년 1월 18일에 개관하였다. ,https://korean.visitseoul.net//data/POST/20221027//202210271332431661,,,인천광역시 중구 제2터미널대로 446  인천국제공항 제2여객터미널 1층 입국장
187,청원산방,전통공예 방식으로 창호를 만드는 장인의 공방,https://korean.visitseoul.net//data/MEDIA/20230714/0714112437935-dde7a142ff8441ec9b09018077c2f677.jpg,평점:4.5,,서울 종로구 북촌로6길 27 (계동)
188,카이스갤러리,청담동은 오래전부터 서울 갤러리 문화의 한축으로 자리매김했다. 1997년 게르하르드 리히터(Gerhard Richter)를 시작으로 국내외 주요 작가들의 작품을 전시해온 카이스갤러리도 그 중 하나다. ,https://korean.visitseoul.net//data/POST/20170921//201709211707014491,평점:3.5,,서울 강남구 언주로174길 13 (신사동)  1층
189,갤러리 팩토리,살롱 드 팩토리는 서울 마포구 서교동에 위치한 카페다. ,https://korean.visitseoul.net//data/POST/20161208//201612081131366371,평점:4.0,,서울 종로구 자하문로10길 15
190,짚풀생활사박물관,종로구 명륜동에 위치한 짚풀생활사박물관은 사립박물관으로 청담동에서 운영되다가 옮겨져 왔다.,https://korean.visitseoul.net//data/POST/20170825//201708251729080701,,,서울 종로구 성균관로4길 45 (명륜2가)
191,광희문,시구문(屍軀門) ·수구문(水口門)이라고도 하였으며 서소문(西小門)과 함께 시신(屍身)을 내보내던 문이다.,https://korean.visitseoul.net//data/POST/20190701//201907011127537901,평점:4,8 ,서울 중구 퇴계로 350 (신당동)
192,홍지문 탕춘대성,홍지동에 자리한 탕춘대성의 성문인 홍지문은 조선시대 숙종 41년에 서울 도성과 북한산성을 보완하기 위해 세워졌다.,https://korean.visitseoul.net//data/POST/20170829//201708291326521031,평점:3.0,,서울특별시 종로구 세검정로 212 (홍지동)
193,서울도시건축전시관,"시민들이 도심 내 휴식을 향유하는 동시에 도시, 건축에 관심있는 모든 국내외인들에게 관련 자료를 공유하고 관련 전시 및 행사를 체험하는 곳입니다.",https://korean.visitseoul.net//data/POST/20200529//202005291506314501,,,서울 중구 세종대로 119 (태평로1가)
194,원효로성당,원효로성당은 서울 용산구 원효로에 위치해 있으며 서울 용산신학교와 나란히 세워져 있다. ,https://korean.visitseoul.net//data/POST/20170914//201709141119566671,평점:3.0,,서울 용산구 원효로19길 49 (원효로4가)
195,명신당필방,예술가들과 함께 성장한 문방사우 가게,https://korean.visitseoul.net//data/MEDIA/20230629/0629145327071-93bf1ca7fa4c41d9b050442a1772bbee.jpg,평점:4.5,,서울 종로구 인사동길 34
196,서울도시재생이야기관,서울도시재생이야기관은 도시재생에 대한 정보와 비전을 나누고 도시재생을 함께 만드는 사람들의 발자취를 공유하는 공간입니다. ,https://korean.visitseoul.net//data/POST/20200727//202007271640377471,평점:4.5,,"서울 종로구 송월길 2 (신문로2가, 서울도시건축센터)"
197,구 공업전습소 본관(구 중앙시험소 청사),종로구 동숭동에 위치한 구공업전습소보관은 1981년 사적 제289호로 지정되었고 1906년 대한제국 때 설립된 것으로 알려져 있다.,https://korean.visitseoul.net//data/POST/20160927//0927142445603-ef2d5b0e47ea4425969cf1c2a2dd9862.jpg,평점:3.5,,서울 종로구 대학로 86  한국방송통신대학교 역사관
198,광화문 관광안내소,"광화문에 위치한 관광안내소로 서울을 방문하는 여행객들에게 여행 정보, 통역 안내 서비스, 예약 서비스, 관광홍보물, 편의시설을 제공한다.",https://korean.visitseoul.net//data/POST/20181026//201810261653267221,평점:3.5,,서울 종로구 세종대로 145-2 (광화문빌딩)  동화면세점 앞
199,안녕인사동 ,"안녕인사동은 어제, 오늘, 내일을 잇는 공간을 담아 추억과 즐거움을 선사하는 문화복합몰이다. ",https://korean.visitseoul.net//data/POST/20191217//201912171754001131,평점:4.5,,서울 종로구 인사동길 49 (관훈동)  안녕인사동
200,용산역관광정보센터,용산역 관광정보센터는 서울 용산역사에 위치해 있는 관광안내소이다.,https://korean.visitseoul.net//data/POST/20181025//201810251339115101,평점:3.0,,"서울 용산구 한강대로23길 55 (한강로3가, 용산역)"
201,동대문 관광안내소,"동대문역사문화공원역 앞에 위치한 관광안내소로 서울을 방문하는 여행객들에게 여행 정보, 통역 안내 서비스, 관광홍보물, 편의시설을 제공한다.",https://korean.visitseoul.net//data/POST/20181026//201810261704245651,평점:4.0,,서울 중구 장충단로 247 (굿모닝시티쇼핑몰)
202,소덕문 터(옛 서소문),소덕문은 도성의 서남쪽인 숭례문과 돈의문의 중간지점에 있었다. 도성의 4개의 소문(小門) 중 하나로서 태조 5년에 다른 성문들과 함께 건설되었다.,https://korean.visitseoul.net//data/POST/20190701//201907011140132811,평점:4.0,,서울 중구 서소문로 100 (중앙일보 구관)
203,영등포관광정보센터,영등포관광정보센터는 서울 서남권 중심거점이자 하루 수십만의 유동인구가 지나고 있는 타임스퀘어 광장에 2017년 9월 개관했다. ,https://korean.visitseoul.net//data/POST/20181025//201810251134294561,평점:4.0,,"서울 영등포구 영중로 15 (영등포동4가, 타임스퀘어)"
204,세운청계상가,1960년대 주상복합건물로 지어진 세운청계상가는 드라마 빈센조의 금가프라자로 등장을 하며 많은 사람들이 방문하는 핫플레이스로 자리 잡았다.,https://korean.visitseoul.net//data/POST/20210624//202106241813477851,평점:4.0,,"서울 중구 청계천로 160 (산림동, 세운청계상가)"
205,서울역사박물관 온라인 교육 서비스,"""언제 어디서나 만날 수 있는 박물관"" 서울역사박물관 온라인 교육 서비스 ",https://korean.visitseoul.net//data/POST/20200408//202004081552554411,평점:4.5,,서울 종로구 새문안로 55 (신문로2가)
206,을지다방,BTS도 반한 특제 쌍화탕이 있는 찻집,https://korean.visitseoul.net//data/MEDIA/20230630/0630152034841-ff621b7b3a1046d38f3775dd769582a6.jpg,평점:4.0,,서울 중구 을지로 124-1 2층
207,남대문시장 관광안내소,"남대문 시장에 위치한 관광안내소로 서울을 방문하는 여행객들에게 여행 정보, 통역 안내 서비스, 예약 서비스, 관광홍보물, 편의시설을 제공한다.",https://korean.visitseoul.net//data/POST/20181026//201810261635383671,평점:4.0,,서울 중구 남대문시장4길 32 (남대문코코클럽)
208,봉황각,봉황각은 1912년 천도교의 지도자를 양성하기 위해 손병희가 설립한 2층 목조 기와집의 교육시설이다. ,https://korean.visitseoul.net//data/POST/20170831//201708311053065531,,,북구 삼양로173길 107-12 (우이동)
209,종로양복점,1916년 일본 유학으로 배워 온 맞춤 양복계의 선구자,https://korean.visitseoul.net//data/MEDIA/20230714/0714110919966-c73c4ed10b334141a17a7d4a0fcf077e.jpg,평점:4.0,,서울 중구 수표로 45 (을지비즈센터)  618호 종로양복점
210,마포관광정보센터,마포관광정보센터는 홍대입구역 7번 출구에서 도보 3분 거리에 있는 관광안내소이다. ,https://korean.visitseoul.net//data/POST/20181025//201810250940489501,평점:4.0,,서울 마포구 홍익로 22 (서교동)
211,삼성출판박물관,삼성출판박물관은 출판·인쇄 문화유산을 수집 전시하기 위하여 설립한 박물관으로 종로구 구기동에 있는 사립 출판 전문박물관이다.,https://korean.visitseoul.net//data/POST/20190805//201908051528598411,평점:3.0,,"서울 종로구 비봉길 2-2 (구기동, 삼성출판박물관)"
212,ECC(Ewha Campus Complex),ECC(Ewha Campus Complex)는 이화여자대학교 캠퍼스 내에 조성한 복합 단지다. ,https://korean.visitseoul.net//data/POST/20190208//201902081921109421,평점:3.5,,"서울 서대문구 이화여대길 52 (대현동, 이화여자대학교)"
213,남산케이블카,남산의 풍광을 한눈에 조망할 수 있는 남산케이블카,https://korean.visitseoul.net//data/POST/20200831//202008311229096941,평점:4.0,,"서울 중구 소파로 83 (회현동1가, 남산케이블카)"
214,국선옻칠,문화재기능인이 만드는 한국 나전칠기의 멋 ,https://korean.visitseoul.net//data/MEDIA/20230629/0629113445108-f8cc3841697041808698f405e766ad85.jpg,평점:4.0,,서울 종로구 창경궁로 88 광장3층 2390호
215,갤러리 3안,"삼청동에 개관한 갤러리 3안은 회화, 영상, 조각, 설치 외 다양한 예술 분야를 다루고 있으며 구애받지 않는 실험 정신을 가진 아티스트들의 작품을 감상할 수 있다.",https://korean.visitseoul.net//data/POST/20180413//201804131036142141,평점:4.0,,서울 종로구 북촌로 137-7 (삼청동)
216,홍익문고,오랜 추억을 간직한 신촌 대표 서점,https://korean.visitseoul.net//data/MEDIA/20230630/0630110256479-7de1a14e06c74897b9b81c3654630a89.jpg,평점:4.0,,서울 서대문구 연세로 2
217,춘당지,창경궁 내에 있는 아름다운 춘당지,https://korean.visitseoul.net//data/POST/20211117//202111171447149281,평점:4.5,,"서울 종로구 창경궁로 185 (와룡동, 창경궁)"
218,탈방 ,다양한 종류의 전통 수공예 탈을 만나볼 수 있는 곳,https://korean.visitseoul.net//data/MEDIA/20230629/0629145856624-26229854883849ceadc7c8f152d223eb.jpg,평점:1.0,,서울 종로구 인사동길 48 (관훈동)
219,신촌역사 관광안내소,"신촌 구역사에 위치한 관광안내소로 서울을 방문하는 여행객들에게 여행 정보, 통역 안내 서비스, 예약 서비스, 관광홍보물, 편의시설을 제공한다.",https://korean.visitseoul.net//data/POST/20181026//201810261708099491,평점:4.5,,"서울 서대문구 신촌역로 30 (신촌동, 신촌민자역사)  신촌역사 내"
220,돈의문역사관,돈의문전시관은 새문안 동네의 식당으로 운영되던 건물들을 활용하여 새롭게 조성한 문화공간이다. ,https://korean.visitseoul.net//data/POST/20190502//201905021703330271,평점:4.5,,서울 종로구 새문안로 35-54 (신문로2가)
221,aT센터,"aT센터는 국제적인 전시, 컨벤션과 무역 비즈니스가 한 곳에서 이루어지는 새로운 스타일의 전시, 컨벤션센터이다.",https://korean.visitseoul.net//data/POST/20190528//201905281355287611,평점:4.5,,"서울 서초구 강남대로 27 (양재동, AT센터)"
222,통문관,국보급 문화재들이 발견된 국내 최고령 고서점,https://korean.visitseoul.net//data/MEDIA/20230630/0630101900411-be234f4d0b2349ca9fbb71087d3fa8ea.jpg,평점:4.0,,서울 종로구 인사동길 55-1
223,돌 레코드,보물 같은 사람들의 추억이 숨어 있는 중고 음반 가게,https://korean.visitseoul.net//data/MEDIA/20230630/0630154900948-e6aa26657279488fb247cae4f3fc4531.jpg,평점:4.5,,서울 중구 마장로9길 49-29
224,황학정,황학정은 국민들의 심신단련을 위해 궁술은 장려되어야 한다고 생각하는 고종황제의 뜻에 따라 지어진 유서 깊은 활터이다. ,https://korean.visitseoul.net//data/POST/20190611//201906110955183191,평점:4.5,,서울 종로구 사직로9길 15-32 (사직동)
225,서울 관광기념품 전시관•여행자지원센터,"종로에 위치한 관광안내소로 서울을 방문하는 여행객들에게 여행 정보, 통역 안내 서비스, 예약 서비스, 관광홍보물, 편의시설을 제공한다.",https://korean.visitseoul.net//data/POST/20181026//201810261639445591,평점:4.5,,서울 종로구 청계천로 85 (삼일빌딩)  앞 보도
226,삼청로 안내소,"삼청동에 위치한 관광안내소로 서울을 방문하는 여행객들에게 여행 정보, 통역 안내 서비스, 예약 서비스, 관광홍보물, 편의시설을 제공한다.",https://korean.visitseoul.net//data/POST/20181026//201810261711413551,평점:4.0,,서울 종로구 삼청로 68 (안송빌딩)
227,절두산순교성지,1866년 병인박해 때 순교한 천주교인의 신앙과 얼을 널리 알리기 위하여 서울 마포구에 1967년 10월 절두산순교기념관으로 개관한 뒤 한국천주교순교자박물관으로 이름을 바꾸었다.,https://korean.visitseoul.net//data/POST/20190507//201905071619311511,평점:5.0,,"서울 마포구 토정로 6 (합정동, 한국천주교순교자박물관)"
228,용산공예관,"공예문화의 과거와 현재, 도시와 도시를 이어주는 네트워크 플랫폼 : 용산공예관",https://korean.visitseoul.net//data/MEDIA/20231201/1201151130868-ea16e546070e4827a01255c2df3b6f6e.png,평점:4.0,,"서울 용산구 이태원로 274 (한남동, 용산공예관)"
229,봉원사,"봉원사는 신라 진성여왕 3년(889년)에 현 연세대 터에 창건한 절로, 조선 영조 24년(1748년) 때 지금의 터전으로 이전했다. ",https://korean.visitseoul.net//data/POST/20190208//201902081928206981,평점:4.5,,서울 서대문구 봉원사길 120 (봉원사)
230,이태원 관광안내소(지하),"이태원역사 내에 위치한 관광안내소로 서울을 방문하는 여행객들에게 여행 정보, 통역 안내 서비스, 예약 서비스, 관광홍보물, 편의시설을 제공한다.",https://korean.visitseoul.net//data/POST/20181026//201810261631172271,평점:4.0,,"서울 용산구 이태원로 지하 177 (이태원동, 6호선 이태원역)  이태원역사 내"
231,형제대장간 ,"예술가, 작가, 교수들이 찾아오는 인간문화재의 가게",https://korean.visitseoul.net//data/MEDIA/20230628/0628112812859-f3038ec54efa41f490fade8746035899.jpg,,,서울 은평구 수색로 249 (수색동)
232,국립한글박물관 ,"국립한글박물관은 한글과 한글문화 가치의 보존, 확산, 재창조를 위해 설립된 공간이다.	
",https://korean.visitseoul.net//data/POST/20220623//202206231749238001,평점:3.5,,"서울 용산구 서빙고로 139 (용산동6가, 국립한글박물관)"
233,박인당,대한민국명장이 새겨주는 명품 도장,https://korean.visitseoul.net//data/POST/20181011//201810111336234421,평점:5.0,,"서울 종로구 청계천로 55 (관철동, 대신빌딩)  302호"
